{
  "schema_version": "1.0.0",
  "followup_id": "followup_001",
  "marker_id": "marker_001",
  "subject_id": "subj_001",
  "gumi_instance_id": "gumi_001",
  "hermes_profile_id": "hermes_gumi_subj_001",

  "max_attempts": 3,
  "attempt_count": 1,
  "status": "due",

  "followup_interval_seconds": 86400,
  "next_followup_at": "2026-05-09T10:00:00Z",
  "ttl_seconds": 604800,
  "created_at": "2026-05-08T10:00:00Z",
  "expires_at": "2026-05-15T10:00:00Z",

  "last_attempt_at": "",
  "last_result": "",
  "acknowledged_at": "",

  "is_paused": false,
  "paused_at": "",
  "resumed_at": ""
}